{
  "$schema": "../../schema/token.schema.json",
  "chain_id": "luxa-1",
  "type": "cw20",
  "contract": "luxa1aakfpghcanxtc45gpqlx8j3rq0zcpyf49qmhm9mdjrfx036h4z5sdj4ev2",
  "symbol": "MOJO",
  "name": "MOJO",
  "decimals": 6,
  "description": "Official MOJO CW20 ecosystem token deployed on the LUXA Sovereign L1 blockchain.",
  "logo": "logo.png",
  "website": "https://luxaecosystem.xyz",
  "tags": ["ecosystem", "community"],
  "pool": {
    "contract": "luxa1w798gp0zqv3s9hjl3jlnwxtwhykga6rn93p46q2crsdqhaj3y4gsnlswwa"
  }
}