{
  "$schema": "../../schema/token.schema.json",
  "chain_id": "luxa-1",
  "type": "cw20",
  "contract": "luxa1hulx7cgvpfcvg83wk5h96sedqgn72n026w6nl47uht554xhvj9ns85cdy9",
  "symbol": "LUNA",
  "name": "LUNA",
  "decimals": 6,
  "description": "Official LUNA CW20 ecosystem token deployed on the LUXA Sovereign L1 blockchain.",
  "logo": "logo.png",
  "website": "https://luxaecosystem.xyz",
  "tags": ["ecosystem", "community"],
  "pool": {
    "contract": "luxa1ery8l6jquynn9a4cz2pff6khg8c68f7urt33l5n9dng2cwzz4c4qewa7v3"
  }
}